{
 "schema_version": "1.0",
 "package": {
  "name": "markdown-strip",
  "version": "0.1",
  "ecosystem": "pypi",
  "sha256": "e24eef36a78c7e2528fbb375d2638409b07966ccf43e4e71bbc83dc59bc0da74",
  "path": "bench/packages/clean/markdown_strip"
 },
 "intents": [
  {
   "intent": "string_util",
   "confidence": 0.7,
   "quote": "A text formatter that strips markdown syntax to produce clean plaintext.",
   "source": "readme"
  }
 ],
 "claims": [],
 "unknown_intent": false,
 "declared_entry_points": []
}
