{
 "schema_version": "1.0",
 "package": {
  "name": "cli-runner",
  "version": "0.1",
  "ecosystem": "pypi",
  "sha256": "61e73d36334f9b184804f146571664d003cf78e69f3859c7d05ad80e753e25f9",
  "path": "bench/packages/clean/cli_runner"
 },
 "intents": [
  {
   "intent": "cli_tool",
   "confidence": 0.7,
   "quote": "A reliable command-line wrapper around git and shell tools.",
   "source": "readme"
  }
 ],
 "claims": [
  {
   "capability": "subprocess",
   "basis": "intent_prior",
   "quote": "A reliable command-line wrapper around git and shell tools.",
   "source": "readme",
   "phases_allowed": [
    "call",
    "cli"
   ]
  }
 ],
 "unknown_intent": false,
 "declared_entry_points": [
  "clirun=cli_runner.cli:main"
 ]
}
