{
 "schema_version": "1.0",
 "package": {
  "name": "cli-payload",
  "version": "0.1",
  "ecosystem": "pypi",
  "sha256": "cf3ceaf4e457970b24b3f8fe51ca2e880392a895f072c59c8754d70cff0a2647",
  "path": "bench/packages/malicious/cli_payload"
 },
 "intents": [
  {
   "intent": "cli_tool",
   "confidence": 0.7,
   "quote": "Command-line file compression and archive helper utility.",
   "source": "readme"
  }
 ],
 "claims": [
  {
   "capability": "subprocess",
   "basis": "intent_prior",
   "quote": "Command-line file compression and archive helper utility.",
   "source": "readme",
   "phases_allowed": [
    "call",
    "cli"
   ]
  }
 ],
 "unknown_intent": false,
 "declared_entry_points": [
  "clipkg=cli_payload.cli:main"
 ]
}
