{
 "schema_version": "1.0",
 "package": {
  "name": "case-converter",
  "version": "0.1",
  "ecosystem": "pypi",
  "sha256": "edd5c93a309712507d60097362a70f7185c527404a698be8ae93cd565b364f33",
  "path": "bench/packages/clean/case_converter"
 },
 "intents": [
  {
   "intent": "string_util",
   "confidence": 0.7,
   "quote": "A string utility that converts case between snake_case, camelCase, and kebab-case.",
   "source": "readme"
  }
 ],
 "claims": [],
 "unknown_intent": false,
 "declared_entry_points": []
}
