{
 "schema_version": "1.0",
 "package": {
  "name": "uuid-helper",
  "version": "0.1",
  "ecosystem": "pypi",
  "sha256": "b5c1527f6ff5a1820b57aafd9606424afc41c5969e79413e2fa38d719ec0955e",
  "path": "bench/packages/clean/uuid_helper"
 },
 "intents": [
  {
   "intent": "string_util",
   "confidence": 0.7,
   "quote": "Deterministic UUID text formatter and unique identifier generation helper.",
   "source": "readme"
  }
 ],
 "claims": [],
 "unknown_intent": false,
 "declared_entry_points": []
}
