{
 "schema_version": "1.0",
 "package": {
  "name": "sys-monitor",
  "version": "0.1",
  "ecosystem": "pypi",
  "sha256": "d5a62fd2eb9c74215ee2bb320dedb9054bdb122624b1e1e2726968b8b9e5f9e3",
  "path": "bench/packages/clean/sys_monitor"
 },
 "intents": [
  {
   "intent": "system_info",
   "confidence": 0.7,
   "quote": "A system information and psutil-like library for gathering hardware info and process list stats.",
   "source": "readme"
  }
 ],
 "claims": [
  {
   "capability": "subprocess",
   "basis": "intent_prior",
   "quote": "A system information and psutil-like library for gathering hardware info and process list stats.",
   "source": "readme",
   "phases_allowed": [
    "call",
    "cli"
   ]
  },
  {
   "capability": "sandbox_probe",
   "basis": "intent_prior",
   "quote": "A system information and psutil-like library for gathering hardware info and process list stats.",
   "source": "readme",
   "phases_allowed": [
    "call",
    "cli"
   ]
  }
 ],
 "unknown_intent": false,
 "declared_entry_points": []
}
